Behavior,Normal Users (avg),Insider Threats (avg),Difference,Ratio
Sensitive File Reads (Peak),33.561740890688256,49.523809523809526,15.96206863312127,1.4756031185959715
Emails With Attachments (Peak),6.886639676113361,8.047619047619047,1.1609793715056869,1.1685843061504437
External Emails Sent (Peak),11.082995951417004,10.571428571428571,-0.511567379988433,0.9538421395955642
Cloud Upload Events (Peak),1.4534412955465588,1.9047619047619047,0.4513206092153459,1.3105186364239287
After Hours Logons (Peak),3.116396761133603,2.9523809523809526,-0.16401580875265065,0.9473700490264311
